content|translated|likes|workId|sentiment|country|platform|postTime
剧情跑太快了。 跟不上的老婆看着看着就睡觉了。 对她来说，最难忘的是made in China的戒指。|剧情跑太快了。 跟不上的老婆看着看着就睡觉了。 对她来说，最难忘的是made in China的戒指。|0|4|积极|中国|Youtube|2023-01-30
美国可没这种格局|美国可没这种格局|1|4|中立|中国|Youtube|2023-01-30
Just watch it. It did not disappoint at all; it really tells the story before the event of the first movie. What I like about the movie is that it sh|看着吧。它一点也没有让人失望;它确实讲述了第一部电影发生之前的故事。我喜欢这部电影的一点是它很搞笑|347|4|积极|爱尔兰|Youtube|2023-01-30
看完后太喜欢了！！啊啊啊啊啊，一定要去看啊  人类由于没有了天敌，最终靠自己的力量造出了自己的敌人|看完后太喜欢了！！啊啊啊啊啊，一定要去看啊  人类由于没有了天敌，最终靠自己的力量造出了自己的敌人|5|4|积极|中国|Youtube|2023-01-30
The trailer is too conservative|预告片太保守了|1|4|积极|澳大利亚|Youtube|2023-01-30
The movie that can possibly encounter this one is going to be The Wonder Earth 3|可能遇到这种情况的电影将是《神奇地球3》|1|4|积极|英国|Youtube|2023-01-30
China copies American movies II |中国抄袭美国电影2|0|4|积极|西班牙|Youtube|2023-01-29
uk?|英国吗?|0|4|积极|爱尔兰|Youtube|2023-01-29
请评论区里的台湾同胞不要从讨厌大陆或者cpc的角度批判这个电影，好看就说好看，不好看就说为什么不好看，回归电影本身，这里不是讨论政治的地方，这里是讨论流浪地球电影的地方，想讨论别的麻烦移步|请评论区里的台湾同胞不要从讨厌大陆或者cpc的角度批判这个电影，好看就说好看，不好看就说为什么不好看，回归电影本身，这里不是讨论政治的地方，这里是讨论流浪地球电影的地方，想讨论别的麻烦移步|70|4|积极|中国|Youtube|2023-01-29
垃圾电影|垃圾电影|0|4|消极|中国|Youtube|2023-01-29
确实拍的很棒，比第一部要好，就是前半部感觉节奏快了一些，但是瑕不掩瑜，一部很棒的科幻片，没有个人英雄主义，没有那些扯淡的超能力，有的只是一个个普通人为了保护人类文明在做努力！！让我感觉那些超人还有漫威电影更适合小孩子看。|确实拍的很棒，比第一部要好，就是前半部感觉节奏快了一些，但是瑕不掩瑜，一部很棒的科幻片，没有个人英雄主义，没有那些扯淡的超能力，有的只是一个个普通人为了保护人类文明在做努力！！让我感觉那些超人还有漫威电影更适合小孩子看。|43|4|积极|中国|Youtube|2023-01-29
第一部就是一坨碳水化合物，但是第二部是把里面的碳原子组成碳60，简直像钻石一样闪耀！|第一部就是一坨碳水化合物，但是第二部是把里面的碳原子组成碳60，简直像钻石一样闪耀！|8|4|消极|中国|Youtube|2023-01-29
The wandering earth made me feel that the american superhero films are better for kids. :  )|《流浪地球》让我觉得美国超级英雄电影更适合孩子们看。:)|135|4|积极|马来西亚|Youtube|2023-01-29
無廣東話版?|无广东话版?|0|4|中立|中国|Youtube|2023-01-29
一部好电影就是一顿美味的精神食粮，而流浪地球2则是一顿丰盛的精神盛宴，看完后意犹未竟，嘴角余味长留。希望中国导演制片人都争气，少搞一些烂片。|一部好电影就是一顿美味的精神食粮，而流浪地球2则是一顿丰盛的精神盛宴，看完后意犹未竟，嘴角馀味长留。希望中国导演制片人都争气，少搞一些烂片。|0|4|积极|中国|Youtube|2023-07-03
主角不是刘德华，别搏懵。|主角不是刘德华，别搏懵。|0|4|积极|中国|Youtube|2023-06-05
用几十年来建造发送器推送地球，为何不建造超级太空船把全人类载离地球？|用几十年来建造发送器推送地球，为何不建造超级太空船把全人类载离地球？|0|4|积极|中国|Youtube|2023-05-31
很討厭那個馬兆. 那個演員說對白接近70%聽不懂他在說什麼. 感覺一直在耍帥. 演技是其次. 首先要觀眾聽出每一個字的對白才是好演員|很讨厌那个马兆. 那个演员说对白接近70%听不懂他在说什么. 感觉一直在耍帅. 演技是其次. 首先要观众听出每一个字的对白才是好演员|0|4|积极|中国|Youtube|2023-05-31
國產科幻終於擺脫只著眼於特效的枷鎖， 這是一部有靈魂的科幻大作， 國產科幻的里程碑。|国产科幻终于摆脱只着眼于特效的枷锁， 这是一部有灵魂的科幻大作， 国产科幻的里程碑。|2|4|积极|中国|Youtube|2023-05-27
作者说 对了 流浪地球计划 其实可以拍的更有反转才行。 就是这个计划到最后发现还不如数字生命计划。|作者说 对了 流浪地球计划 其实可以拍的更有反转才行。 就是这个计划到最后发现还不如数字生命计划。|0|4|积极|中国|Youtube|2023-05-16
最少还能拍三部|最少还能拍三部|0|4|中立|中国|Youtube|2023-05-08
我看了三遍，真的好多细节。|我看了三遍，真的好多细节。|0|4|积极|中国|Youtube|2023-04-28
应该不是四维，是量子计算机的并行计算，同时有很多种可能。可以理解成世界树|应该不是四维，是量子计算机的并行计算，同时有很多种可能。可以理解成世界树|0|4|积极|中国|Youtube|2023-04-22
有点解读过度|有点解读过度|0|4|积极|中国|Youtube|2023-04-22
要等第三部出來了..才能解釋MOSS.現在全都漏了..第三部就沒什麼看了.|要等第三部出来了..才能解释MOSS.现在全都漏了..第三部就没什么看了.|0|4|消极|中国|Youtube|2023-04-17
结果是一定的，过程是随机的。|结果是一定的，过程是随机的。|0|4|中立|中国|Youtube|2023-03-05
反派的逻辑也自洽是最可怕的|反派的逻辑也自洽是最可怕的|0|4|中立|中国|Youtube|2023-02-23
黑石碑不能算致敬，本來就是人類超進化的暗示..........|黑石碑不能算致敬，本来就是人类超进化的暗示..........|0|4|积极|中国|Youtube|2023-02-21
恶心。|Disgusting.|0|4|中立|日本|Youtube|2023-02-12
笨笨是不敢下水，工作人员是在推它下海，最后小姐姐补了一脚踢它下去。光头图恒宇和导演心里老年罗辑执剑人形象的手握核弹引爆器的周喆直是moss推演未来结果中可能出现的2种结果，而刘培强扔酒瓶烧moss是既定事实，没有其他变量演算的可能，所以画面依旧还是之前1里的那个画面|笨笨是不敢下水，工作人员是在推它下海，最后小姐姐补了一脚踢它下去。光头图恒宇和导演心里老年罗辑执剑人形象的手握核弹引爆器的周喆直是moss推演未来结果中可能出现的2种结果，而刘培强扔酒瓶烧moss是既定事实，没有其他变量演算的可能，所以画面依旧还是之前1里的那个画面|0|4|积极|中国|Youtube|2023-02-11
笨笨不敢跳 ，“你是军犬”的意思是“勇敢点”， 然后是被踹下去的…|笨笨不敢跳 ，“你是军犬”的意思是“勇敢点”， 然后是被踹下去的…|2|4|消极|中国|Youtube|2023-02-10
还是不太明白为什么图恒宇是变量，作为一个有正常人思维的女儿的父亲，任何情况下我都会同样的选择，用我的生命去换她的一辈子，相反如果不这么做才会是“变量”吧|还是不太明白为什么图恒宇是变量，作为一个有正常人思维的女儿的父亲，任何情况下我都会同样的选择，用我的生命去换她的一辈子，相反如果不这么做才会是“变量”吧|1|4|积极|中国|Youtube|2023-02-09
數字生命由開始有想法時已經失敗了，除非機器不用維修不會壞，不然最終結果都是一㨾！|数字生命由开始有想法时已经失败了，除非机器不用维修不会坏，不然最终结果都是一㨾！|0|4|积极|中国|Youtube|2023-02-09
人類的意識無法脫離肉體啊,有許多意識是屬於肉體經驗的,脫離肉體的意識,已經稱不上是人了...充其量只是另外一種存在,也不算是生物,因為他無法體會到人類的各種痛苦和限制,當然也無法體會到人類肉體上的愉悅|人类的意识无法脱离肉体啊,有许多意识是属于肉体经验的,脱离肉体的意识,已经称不上是人了...充其量只是另外一种存在,也不算是生物,因为他无法体会到人类的各种痛苦和限制,当然也无法体会到人类肉体上的愉悦|0|4|积极|中国|Youtube|2023-02-08
不能赞同这种所谓的进化。作者是先有自己的观点，然后去电影中按照预设观点找论据。这种模式没什么意义|不能赞同这种所谓的进化。作者是先有自己的观点，然后去电影中按照预设观点找论据。这种模式没什么意义|0|4|积极|中国|Youtube|2023-02-08
2023-2-7|The 2023-2-7|0|4|消极|爱尔兰|Youtube|2023-02-07
解析的真好！路转粉。图恒宇这个线路确实让特效科幻有了和诺兰电影科幻媲美的内涵！ 好的电影特别是科幻就是应该看完后还需要琢磨一下。球二这一点做的很高级，因为这条线前有伏笔，后有预测。还让人们对于生命载体有了思考！|解析的真好！路转粉。图恒宇这个线路确实让特效科幻有了和诺兰电影科幻媲美的内涵！ 好的电影特别是科幻就是应该看完后还需要琢磨一下。球二这一点做的很高级，因为这条线前有伏笔，后有预测。还让人们对于生命载体有了思考！|2|4|积极|中国|Youtube|2023-02-06
刘德华，过度操作，适得其反，成语叫过犹不及。|刘德华，过度操作，适得其反，成语叫过犹不及。|0|4|积极|中国|Youtube|2023-02-06
也许车祸时死的不是丫丫而是图恒宇，流浪地球整个过程都是 MOSS虚构出來的，真正被上传意識的正是图恒宇，MOSS同时虚构了无数个场景用来测试图恒宇这个人類在不同情况下的反应，而流浪地球只是其中一个场境，所以为什么MOSS最后说他是个變量。|也许车祸时死的不是丫丫而是图恒宇，流浪地球整个过程都是 MOSS虚构出来的，真正被上传意识的正是图恒宇，MOSS同时虚构了无数个场景用来测试图恒宇这个人类在不同情况下的反应，而流浪地球只是其中一个场境，所以为什么MOSS最后说他是个变量。|4|4|积极|中国|Youtube|2023-02-05
可能整个故事其实都是发生在数字生命里？就像骇客帝国一样。人类已经灭亡，都是上传的数字生命在自我演绎着流浪地球的故事来后悔当初的选择|可能整个故事其实都是发生在数字生命里？就像骇客帝国一样。人类已经灭亡，都是上传的数字生命在自我演绎着流浪地球的故事来后悔当初的选择|0|4|积极|中国|Youtube|2023-02-05
最後也是數字生命派成功發動行星發動機...|最后也是数字生命派成功发动行星发动机...|0|4|中立|中国|Youtube|2023-02-05
人在回路，不是人类回路|人在回路，不是人类回路|0|4|积极|中国|Youtube|2023-02-04
中国对硬核科幻格局不是好莱坞能比的|中国对硬核科幻格局不是好莱坞能比的|1|4|积极|中国|Youtube|2023-02-04
我一直不理解为什么提前倒数每个灾难，现在有点儿理解了|我一直不理解为什么提前倒数每个灾难，现在有点儿理解了|1|4|中立|中国|Youtube|2023-02-04
数字生命才是正义|数字生命才是正义|0|4|积极|中国|Youtube|2023-02-04
对哦！图恒宇被上传的那一幕出现了很多未来的画面，代表他已经能看到未来，且能向过去发送信息，这是否说明他已经踏入了高纬人类的门槛？|对哦！图恒宇被上传的那一幕出现了很多未来的画面，代表他已经能看到未来，且能向过去发送信息，这是否说明他已经踏入了高纬人类的门槛？|2|4|积极|中国|Youtube|2023-02-03
视频赶紧删了从新做吧， 笨笨那，你说的我真的很尴尬。明显是没看电影。|视频赶紧删了从新做吧， 笨笨那，你说的我真的很尴尬。明显是没看电影。|0|4|消极|中国|Youtube|2023-02-03
支持|支持|0|4|积极|中国|Youtube|2023-02-02
面对灾难欧美，小孩女人优先活下去中国，易子而食|面对灾难欧美，小孩女人优先活下去中国，易子而食|0|4|积极|中国|Youtube|2023-02-01
数字生命只适合殡葬业，或者用来保存钱学森，袁隆平等国士的意识|数字生命只适合殡葬业，或者用来保存钱学森，袁隆平等国士的意识|1|4|积极|中国|Youtube|2023-02-01
haohaohao|他们不是|0|4|消极|爱沙尼亚|Youtube|2023-02-01
看完感觉自己就看了个热闹和激动|看完感觉自己就看了个热闹和激动|1|4|积极|中国|Youtube|2023-02-01
本来我看不懂数字生命的意思 一开头我看不懂那个印度人做什么|本来我看不懂数字生命的意思 一开头我看不懂那个印度人做什么|0|4|积极|中国|Youtube|2023-02-01
大哥 笨笨是给踢下去的|大哥 笨笨是给踢下去的|1|4|消极|中国|Youtube|2023-02-01
雖然無縁朝聖，但感覺得出是很深的一部作品|虽然无縁朝圣，但感觉得出是很深的一部作品|4|4|积极|中国|Youtube|2023-02-01
笨笨是上傳狗的意識的ai，博主說錯了|笨笨是上传狗的意识的ai，博主说错了|1|4|消极|中国|Youtube|2023-02-01
好看的科幻片，內容就算了|好看的科幻片，内容就算了|0|4|积极|中国|Youtube|2023-02-01
我们变成了三体人|我们变成了三体人|0|4|中立|中国|Youtube|2023-02-01
首部沒看了！還會想看第二嗎？China 支那的宣傳影片|首部没看了！还会想看第二吗？China 支那的宣传影片|0|4|消极|中国|Youtube|2023-02-01
人类如果不放下一切执念，就永远琐在时间的轮回里，一念起一念灭。球2球3球无止尽…..|人类如果不放下一切执念，就永远琐在时间的轮回里，一念起一念灭。球2球3球无止尽…..|2|4|积极|中国|Youtube|2023-02-01
最后一幕敲门的会不会是马兆，他应该早在太空电梯危机之前就把自己的意识上传到网上了（那时候还没有断网），而且这件事周应该知道，不然他最后不会那么笃定的点火并且说，我们的人，不管是虚拟的还是现实的，都能完成任务，图恒宇不能算是“我们的人”，而且周也不会知道他当时有没有上传意识，真正“我们的人”，应该是|最后一幕敲门的会不会是马兆，他应该早在太空电梯危机之前就把自己的意识上传到网上了（那时候还没有断网），而且这件事周应该知道，不然他最后不会那么笃定的点火并且说，我们的人，不管是虚拟的还是现实的，都能完成任务，图恒宇不能算是“我们的人”，而且周也不会知道他当时有没有上传意识，真正“我们的人”，应该是|9|4|积极|中国|Youtube|2023-02-01
我養過一隻狗也叫笨笨|我养过一只狗也叫笨笨|0|4|消极|中国|Youtube|2023-02-01
太阳氦闪，数字生命用什么硬件承载？|太阳氦闪，数字生命用什么硬件承载？|0|4|积极|中国|Youtube|2023-02-01
其实闪回是跟三体的互动大家互相奔赴，抱头痛哭|其实闪回是跟三体的互动大家互相奔赴，抱头痛哭|0|4|消极|中国|Youtube|2023-07-21
流浪地球是中国第一部真正意义的科幻“大片”|流浪地球是中国第一部真正意义的科幻“大片”|0|4|积极|中国|Youtube|2023-07-15
我喜欢这部电影的一个原因之一，就是“行车不规范，亲人两行泪”这类公益广告植入。。。现在很少人看电视了，而电视、网络平台大多数广告都是商业广告，公益广告很少，而公益广告才是真正对人民素质提升的其中一个途径|我喜欢这部电影的一个原因之一，就是“行车不规范，亲人两行泪”这类公益广告植入。。。现在很少人看电视了，而电视、网络平台大多数广告都是商业广告，公益广告很少，而公益广告才是真正对人民素质提升的其中一个途径|1|4|积极|中国|Youtube|2023-07-08
评论区真搞笑，漫威电影还不是一堆彩蛋和致敬 这就是牧羊犬滤镜？|评论区真搞笑，漫威电影还不是一堆彩蛋和致敬 这就是牧羊犬滤镜？|0|4|积极|中国|Youtube|2023-06-29
EN ESPAÑOL porfavor o en ingles|A ESPAÑOL porfavor o a ingles|0|4|消极|西班牙|Youtube|2023-06-02
全他妈是致敬，全片都致敬就对了|全他妈是致敬，全片都致敬就对了|0|4|积极|中国|Youtube|2023-05-28
牛逼，我是一边重看一边对照。有一个疑问，有人说北京根服务器其实提前十多分钟就恢复了，是MOSS阻断了信号，这个我还没找到点。|牛逼，我是一边重看一边对照。有一个疑问，有人说北京根服务器其实提前十多分钟就恢复了，是MOSS阻断了信号，这个我还没找到点。|0|4|消极|中国|Youtube|2023-05-04
李雪健什麼時侯演過羅輯?|李雪健什么时侯演过罗辑?|1|4|中立|中国|Youtube|2023-05-02
李雪健版本的罗辑真是传神 ……|李雪健版本的罗辑真是传神 ……|10|4|积极|中国|Youtube|2023-04-26
这些细节总结得真不错~|这些细节总结得真不错~|4|4|积极|中国|Youtube|2023-04-26
可惜了劉老師的好書，拍這種垃圾出來還一堆人護航真的笑死。整這些細節不如把整部劇情拍得更好！|可惜了刘老师的好书，拍这种垃圾出来还一堆人护航真的笑死。整这些细节不如把整部剧情拍得更好！|2|4|积极|中国|Youtube|2023-04-26
不足之处是只能给你一个赞，想多给都没办法|不足之处是只能给你一个赞，想多给都没办法|1|4|中立|中国|Youtube|2023-04-25
谁会吃肉馅月饼，这不跟吃大肉粽子一样么，异类|谁会吃肉馅月饼，这不跟吃大肉粽子一样么，异类|1|4|消极|中国|Youtube|2023-04-25
菜单结尾最后有人敲门，说明在moss里不止有图丫丫和图恒宇，还有第三个人。|菜单结尾最后有人敲门，说明在moss里不止有图丫丫和图恒宇，还有第三个人。|7|4|消极|中国|Youtube|2023-04-23
还有个细节，月球危机的时候，布拉柴维尔的餐厅里面卖的是正宗的兰州拉面|还有个细节，月球危机的时候，布拉柴维尔的餐厅里面卖的是正宗的兰州拉面|3|4|积极|中国|Youtube|2023-04-23
三体电视剧里的那个数学天才好像也是济宁人|三体电视剧里的那个数学天才好像也是济宁人|0|4|消极|中国|Youtube|2023-04-21
辅助机械手，1也有过|辅助机械手，1也有过|0|4|消极|中国|Youtube|2023-04-21
本來就是一部爆米花電影，又沒什麽深度。這些所謂的細節沒意義。你真不如直接說電影還好點！|本来就是一部爆米花电影，又没什么深度。这些所谓的细节没意义。你真不如直接说电影还好点！|1|4|积极|中国|Youtube|2023-04-19
刘培强从月球回到领航员空间站，给儿子打电话后也有一个宇航服上171的画面|刘培强从月球回到领航员空间站，给儿子打电话后也有一个宇航服上171的画面|0|4|消极|中国|Youtube|2023-04-19
我真的不是很懂為什麼幾乎所有電影的開車場景，都要安排演司機的東張西望，尤其是跟副駕駛講話的時候硬是要把頭轉過去講|我真的不是很懂为什么几乎所有电影的开车场景，都要安排演司机的东张西望，尤其是跟副驾驶讲话的时候硬是要把头转过去讲|1|4|消极|中国|Youtube|2023-04-18
上线了？|上线了？|0|4|消极|中国|Youtube|2023-04-18
下个星期就考试了但是还是没忍住又重看了一遍|下个星期就考试了但是还是没忍住又重看了一遍|5|4|中立|中国|Youtube|2023-04-18
bad cgi|坏的cgi|0|4|消极|牙买加|Youtube|2023-07-10
太好看了！我在北美拖我不愛看科幻片的俄國老婆去看，她看到哭出來。後來我兩會去又刷了兩遍|太好看了！我在北美拖我不爱看科幻片的俄国老婆去看，她看到哭出来。后来我两会去又刷了两遍|1|4|积极|中国|Youtube|2023-07-08
This is probably the most realistic depiction of a Space Elevator in any sci-fi|这可能是科幻小说中对太空电梯最真实的描述|7|4|积极|加拿大|Youtube|2023-06-25
I watched the movie in the theater a few months ago, it was just far too fantastic! Love the music and design, and I have been coming back to this vi|几个月前我在电影院看了这部电影，真是太精彩了!我很喜欢它的音乐和设计，我一直都喜欢这个vi|4|4|积极|英国|Youtube|2023-06-14
breath taking！在电影院看的时候，因为血脉喷张，右胳膊直接麻了……|breath taking！在电影院看的时候，因为血脉喷张，右胳膊直接麻了……|0|4|消极|中国|Youtube|2023-06-10
Somebody forgot to tell them the point of a space elevator is you don't need rockets, or fight reentry heating for that matter.|有人忘了告诉他们太空电梯的意义是你不需要火箭，也不需要再入大气层加热。|0|4|消极|牙买加|Youtube|2023-06-04
where can i see the full movie. its not in netflix|我在哪里可以看到完整的电影。不在Netflix上|0|4|积极|马来西亚|Youtube|2023-05-27
太帅了|太帅了|0|4|中立|中国|Youtube|2023-05-13
550w Moss|550 w苔藓|0|4|消极|英国|Youtube|2023-05-13
不好睡在电影院看了三个小时|不好睡在电影院看了三个小时|0|4|消极|中国|Youtube|2023-05-13
When I watch this scene in the 4D cinema, I feel I am the guy who is in the elevator|当我在4D影院看这个场景的时候，我感觉我就是那个在电梯里的人|1|4|积极|爱尔兰|Youtube|2023-05-12
I thought that the idea of space elevator was to save the use of rockets.|我认为太空电梯的想法是为了节省火箭的使用。|0|4|中立|澳大利亚|Youtube|2023-05-03
已经有觉青开始无脑黑了，如果台湾电影真有他们说的那么厉害，为什么台湾票房前20只有一部海角七号呢？另外真的有人可以拍出赛德克巴莱大战战狼冷锋这种符合台湾价值的大片吗？|已经有觉青开始无脑黑了，如果台湾电影真有他们说的那么厉害，为什么台湾票房前20只有一部海角七号呢？另外真的有人可以拍出赛德克巴莱大战战狼冷锋这种符合台湾价值的大片吗？|1|4|积极|中国|Youtube|2023-05-03
вместе сила|维梅斯特戒律|1|4|中立|塞尔维亚|Youtube|2023-05-01
太6了!|太6了!|0|4|消极|中国|Youtube|2023-04-30
Best track in the new movie.|新电影中最好的曲目。|0|4|积极|英国|Youtube|2023-04-26
Посмотрел. Поржал|看了。开怀大笑|0|4|积极|俄罗斯|Youtube|2023-04-25
Ive seen better graphics than this in video games.|我在电子游戏中看到过比这更好的图像。|0|4|消极|新西兰|Youtube|2023-04-22
Did the views go down??|浏览量下降了吗?|0|4|中立|美国|Youtube|2023-04-19
比国内流媒体清晰太多了，等BD出了必买|比国内流媒体清晰太多了，等BD出了必买|0|4|积极|中国|Youtube|2023-04-17
cg|cg|0|4|中立|澳大利亚|Youtube|2023-04-16
这段在电影院里即使是最普通的2D屏幕也能看得头皮发麻|这段在电影院里即使是最普通的2D屏幕也能看得头皮发麻|2|4|积极|中国|Youtube|2023-04-15
This movie has been continuously released in China for six months and is still being released. The third installment is already in preparation. Many |这部电影在中国已经连续上映了6个月，目前仍在上映中。第三部已经在筹备中。许多|7|4|积极|加拿大|Youtube|2023-04-15
This weekend, I'm going to the cinema with my son for the second time. It's amazing|这个周末，我要和儿子第二次去看电影。令人惊奇的|4|4|积极|新加坡|Youtube|2023-04-15
好看吗？开局就给炸了！|好看吗？开局就给炸了！|1|4|积极|中国|Youtube|2023-04-12
I first saw the concept of space elevator from Gundam movies and lately on a companion movie prequel of Halo about comander Lansky when he was still |我第一次看到太空电梯的概念是在《高达》电影中，最近是在《光晕》的前传中，关于指挥官Lansky的故事|2|4|积极|美国|Youtube|2023-04-10
this is not the actual scene...this is a CG rendition of the scene (proof of concept) probably leaked from producers team. the actual scene is much m|这不是真实的场景……这是场景的CG渲染(概念证明)，可能是从制作团队泄露的。实际的场景是很有趣的|1|4|积极|马来西亚|Youtube|2023-04-06
HOW DARE THESE MFKERS DESTROY SUCH AN BADASS MACHINE|这些制造商怎么敢摧毁这么厉害的机器|0|4|积极|马来西亚|Youtube|2023-04-06
I have a question. While the Earth is being moved by the engines wouldn't that have some kind of affect on the space elevators like it would send out|我有一个问题。当地球被引擎移动时，这不会对太空电梯产生某种影响，就像它发出的那样|1|4|消极|英国|Youtube|2023-04-02
在电影院里看到的时候，感觉我的座椅成了太空电梯|在电影院里看到的时候，感觉我的座椅成了太空电梯|1|4|消极|中国|Youtube|2023-04-02
