content|translated|likes|workId|sentiment|country|platform|postTime
虽然有一半观点我都不同意 但是还是很喜欢这样的脑洞|虽然有一半观点我都不同意 但是还是很喜欢这样的脑洞|0|4|中立|中国|Youtube|2023-04-28
大聰出品，必屬精品！  謝謝你的聲音陪伴我半夜寫文案的時間。|大聪出品，必属精品！  谢谢你的声音陪伴我半夜写文案的时间。|1|4|积极|中国|Youtube|2023-04-26
550W倒过来就是MOSS|550W倒过来就是MOSS|2|4|消极|中国|Youtube|2023-04-26
550W就是MOSS，把字反过来看。|550W就是MOSS，把字反过来看。|2|4|中立|中国|Youtube|2023-04-26
你能吹两万字的彩虹屁也挺厉害的。|你能吹两万字的彩虹屁也挺厉害的。|0|4|消极|中国|Youtube|2023-04-25
機房泡水泡滿可以修復？核彈交出來不給密碼要硬解好幾天？這……加油呀！|机房泡水泡满可以修复？核弹交出来不给密码要硬解好几天？这……加油呀！|0|4|消极|中国|Youtube|2023-04-25
550W 在丫丫上傳後的1.7秒後就讓月球推進器過載，個人感覺這1.7秒是有跡可循的。地月平均距離是384401km，光從地球到月球需約1.28秒，發送丫丫意識到月球是靠電磁波（電磁波在真空中傳播的速度等於光速），而且第一部說過Moss演算地球撞木星全過程只用了0.42秒，如果把演算時間加上電磁波|550W 在丫丫上传后的1.7秒后就让月球推进器过载，个人感觉这1.7秒是有迹可循的。地月平均距离是384401km，光从地球到月球需约1.28秒，发送丫丫意识到月球是靠电磁波（电磁波在真空中传播的速度等于光速），而且第一部说过Moss演算地球撞木星全过程只用了0.42秒，如果把演算时间加上电磁波|31|4|积极|中国|Youtube|2023-04-25
全網最精闢的流浪地球2解析 非常期待大聰出品的星際穿越 感謝～by the way 看完流浪地球2之後 馬上接著重溫了流浪地球1 發現在2的設定──全球發動機必須精準同步 否則地球將會被撕裂 但流浪地球1裡 發動機的重新啟動 顯然是有相當的時間差 不知是否為bug???|全网最精闢的流浪地球2解析 非常期待大聪出品的星际穿越 感谢～by the way 看完流浪地球2之后 马上接着重温了流浪地球1 发现在2的设定──全球发动机必须精准同步 否则地球将会被撕裂 但流浪地球1里 发动机的重新启动 显然是有相当的时间差 不知是否为bug???|1|4|积极|中国|Youtube|2023-04-25
第一部真心一般 被一帮民族主义sb  视为天花板····无语 。我只能说 第二部才算是中国的第一部正经 科幻大片吧|第一部真心一般 被一帮民族主义sb  视为天花板····无语 。我只能说 第二部才算是中国的第一部正经 科幻大片吧|1|4|积极|中国|Youtube|2023-04-24
牛逼plus，我看完肝都快爆了|牛逼plus，我看完肝都快爆了|0|4|积极|中国|Youtube|2023-04-24
國際與台灣有上映嗎|国际与台湾有上映吗|0|4|积极|中国|Youtube|2023-04-24
解说很好，就是广告太多了|解说很好，就是广告太多了|0|4|中立|中国|Youtube|2023-04-23
连解说听起来都很无聊，完全提不起兴趣看原片。|连解说听起来都很无聊，完全提不起兴趣看原片。|0|4|消极|中国|Youtube|2023-04-23
烂片|烂片|0|4|消极|中国|Youtube|2023-04-22
人类灭绝了，moss怎么生存？全靠机器人维持它的主机动力吗？|人类灭绝了，moss怎么生存？全靠机器人维持它的主机动力吗？|0|4|积极|中国|Youtube|2023-04-22
我觉得最大最明显最无处不在的彩蛋就是 HAL9000 的红眼睛|我觉得最大最明显最无处不在的彩蛋就是 HAL9000 的红眼睛|0|4|积极|中国|Youtube|2023-04-22
netflix會上嗎|netflix会上吗|0|4|中立|中国|Youtube|2023-06-01
神作，比第一部好看|神作，比第一部好看|2|4|积极|中国|Youtube|2023-04-27
想看 但台灣沒有上QAQ|想看 但台湾没有上QAQ|0|4|积极|中国|Youtube|2023-04-18
可以说汪帆是能掌握刘慈欣精粹的，刘慈欣的科幻点出的就是历史感，类似于中国古代历史一样严密的故事|可以说汪帆是能掌握刘慈欣精粹的，刘慈欣的科幻点出的就是历史感，类似于中国古代历史一样严密的故事|0|4|积极|中国|Youtube|2023-03-22
中国科幻里程碑作品。看了一遍觉得屏买小了。|中国科幻里程碑作品。看了一遍觉得屏买小了。|1|4|积极|中国|Youtube|2023-03-18
看完預告還是不知在演啥|看完预告还是不知在演啥|0|4|积极|中国|Youtube|2023-03-06
流浪地球1前段和中段有點枯燥乏味，希望2能有進步|流浪地球1前段和中段有点枯燥乏味，希望2能有进步|0|4|积极|中国|Youtube|2023-03-01
無諗過原來中國嘅科幻電影都拍得住荷里活，劇情環環相扣，格局之大實在震撼人心。劉老師嘅作品不愧係信心保證。值得一提，片中對細節嘅把握稱得上爐火純青，全片邏輯嚴密周全，甚少出現bug位，近年難得嘅佳作！除咗劇情，不得不提劃時代嘅特效畫面，精彩鏡頭一幕接一幕，當你以為呢一幕已經夠晒驚艷，佢竟然可以再黎一|无谂过原来中国嘅科幻电影都拍得住荷里活，剧情环环相扣，格局之大实在震撼人心。刘老师嘅作品不愧系信心保证。值得一提，片中对细节嘅把握称得上炉火纯青，全片逻辑严密周全，甚少出现bug位，近年难得嘅佳作！除咗剧情，不得不提划时代嘅特效画面，精彩镜头一幕接一幕，当你以为呢一幕已经够晒惊艳，佢竟然可以再黎一|7|4|积极|中国|Youtube|2023-03-01
睇完第一次想睇imax版 不過香港冇得睇|睇完第一次想睇imax版 不过香港冇得睇|3|4|积极|中国|Youtube|2023-02-26
點解又要搵個小妹妹做故事線, 明日戰記又係咁, 條橋已經用到爛|点解又要揾个小妹妹做故事线, 明日战记又系咁, 条桥已经用到烂|0|4|积极|中国|Youtube|2023-02-23
剛看了, 劇情雖然不完美但豐富, 視覺效果非常好, 超出預期, 值得一看。|刚看了, 剧情虽然不完美但丰富, 视觉效果非常好, 超出预期, 值得一看。|3|4|积极|中国|Youtube|2023-02-21
評論太多吱吱作響|评论太多吱吱作响|1|4|消极|中国|Youtube|2023-02-16
在這片神奇的土地上居委會大媽可以限制你的自由，大白可以衝進你家抓你去方艙可以把你家消毒，可以搶光妳家的冰箱食物，警察可以踹開妳家的房門，連自己跟自己的家人都保護不了，卻還想拯救地球，不管電影有多好就感覺他們是人格分裂，就像一個精神病人每天被醫生灌藥被電擊，卻還在思考自己下一屆能不能當選中央總書記。|在这片神奇的土地上居委会大妈可以限制你的自由，大白可以冲进你家抓你去方舱可以把你家消毒，可以抢光妳家的冰箱食物，警察可以踹开妳家的房门，连自己跟自己的家人都保护不了，却还想拯救地球，不管电影有多好就感觉他们是人格分裂，就像一个精神病人每天被医生灌药被电击，却还在思考自己下一届能不能当选中央总书记。|2|4|积极|中国|Youtube|2023-02-15
共產黨主導和投資的電影 難怪台灣沒有上映|共产党主导和投资的电影 难怪台湾没有上映|0|4|积极|中国|Youtube|2023-02-15
电影的格局是全世界，人类命运共同体|电影的格局是全世界，人类命运共同体|3|4|积极|中国|Youtube|2023-02-15
"看了流浪地球2，有生之年系列。真的，没有想到会到这样的一天，看阿凡达2没有肾上腺素飙升，却看同期的国产科幻片时浑身起鸡皮疙瘩！震撼得不能自已。。。。。回到家翻来覆去睡不着，于是做了一部流浪地球特辑视频《无需摇号进入北京3号发动机地下城》，算是对主创的感谢。。。哈哈"|"看了流浪地球2，有生之年系列。真的，没有想到会到这样的一天，看阿凡达2没有肾上腺素飙升，却看同期的国产科幻片时浑身起鸡皮疙瘩！震撼得不能自已。。。。。回到家翻来复去睡不着，于是做了一部流浪地球特辑视频《无需摇号进入北京3号发动机地下城》，算是对主创的感谢。。。哈哈"|9|4|积极|中国|Youtube|2023-02-15
流浪地球2》已經不夠看，沒有台灣價值，在台灣菜皇眼中不過尔尔，準備要開拍《移動台灣》綠腦神戰紀，大家等著看吧！|流浪地球2》已经不够看，没有台湾价值，在台湾菜皇眼中不过尔尔，准备要开拍《移动台湾》绿脑神战纪，大家等着看吧！|9|4|积极|中国|Youtube|2023-02-15
第一集就超好看 懷念達叔|第一集就超好看 怀念达叔|16|4|积极|中国|Youtube|2023-02-14
第一集還裝得像科幻片，第二集直接不演了，妥妥宇宙版戰狼。|第一集还装得像科幻片，第二集直接不演了，妥妥宇宙版战狼。|3|4|积极|中国|Youtube|2023-02-13
真的不错|真的不错|3|4|积极|中国|Youtube|2023-02-13
已经三刷了，特别是太空电梯升空那断，太爽了！|已经三刷了，特别是太空电梯升空那断，太爽了！|4|4|消极|中国|Youtube|2023-02-13
友情提點：提前屙尿，唔好飲水。就咁多！|友情提点：提前屙尿，唔好饮水。就咁多！|4|4|中立|中国|Youtube|2023-02-13
港澳、新马还没上映吗？|港澳、新马还没上映吗？|0|4|积极|中国|Youtube|2023-02-13
为了观影体验，推荐别看这些，不然会失去震撼感，很多人觉得三个小时长，我完全没感觉到，很快就过去了，很多人觉得难理解，我对此感到难以理解，毕竟人家这些线都是明线，都是通过明示，暗示，告诉你了。剧情就是这么直接。|为了观影体验，推荐别看这些，不然会失去震撼感，很多人觉得三个小时长，我完全没感觉到，很快就过去了，很多人觉得难理解，我对此感到难以理解，毕竟人家这些线都是明线，都是通过明示，暗示，告诉你了。剧情就是这么直接。|3|4|积极|中国|Youtube|2023-02-12
三个小时不舍得上厕所的路过|三个小时不舍得上厕所的路过|7|4|消极|中国|Youtube|2023-02-12
特效庞大震撼|特效庞大震撼|3|4|积极|中国|Youtube|2023-02-12
好看的！我三年没进影院，过年时去看了！绝对值回票价！看完还去找了流浪地球1看了，个人更喜欢2。|好看的！我三年没进影院，过年时去看了！绝对值回票价！看完还去找了流浪地球1看了，个人更喜欢2。|6|4|积极|中国|Youtube|2023-02-12
好多好壯觀既畫面, 特別係太空電梯真係震撼 比阿凡達2 好睇|好多好壮观既画面, 特别系太空电梯真系震撼 比阿凡达2 好睇|35|4|积极|中国|Youtube|2023-02-11
香港影院的排片不太给力呀。感觉思想还未转变，，，|香港影院的排片不太给力呀。感觉思想还未转变，，，|7|4|积极|中国|Youtube|2023-02-11
Like the idea of having an AI villain, a plot element explored in the Terminator and X-Men films.|就像《终结者》和《x战警》电影中探索的AI反派情节元素一样。|3|4|积极|美国|Youtube|2023-02-11
好多腦震動，好強震撼，好多感人情節，好多日了，影片也不離不開我的思想，太真實太震撼太感人，比Avator好多了！|好多脑震动，好强震撼，好多感人情节，好多日了，影片也不离不开我的思想，太真实太震撼太感人，比Avator好多了！|39|4|积极|中国|Youtube|2023-02-11
好像香港票房很低啊，是香港黄丝太多了，还是不习惯普通话？|好像香港票房很低啊，是香港黄丝太多了，还是不习惯普通话？|2|4|积极|中国|Youtube|2023-02-11
秒杀全世界最近3年所有科幻片，科幻迷必须看IMAX或者杜比|秒杀全世界最近3年所有科幻片，科幻迷必须看IMAX或者杜比|2|4|积极|中国|Youtube|2023-02-11
刷两遍，第一遍刷直观，回来了解清楚再看第二遍完全不一样感觉，牛人刷五遍以上，找各类影院，什么巨屏，imax等。|刷两遍，第一遍刷直观，回来了解清楚再看第二遍完全不一样感觉，牛人刷五遍以上，找各类影院，什么巨屏，imax等。|0|4|积极|中国|Youtube|2023-02-10
不要喝水，不要喝水，不要喝水！|不要喝水，不要喝水，不要喝水！|11|4|消极|中国|Youtube|2023-02-10
不带任何爱国感情看这也是部好片|不带任何爱国感情看这也是部好片|7|4|积极|中国|Youtube|2023-02-10
不带任何爱国感情看这也是部好片|不带任何爱国感情看这也是部好片|16|4|积极|中国|Youtube|2023-02-10
大家記得留低睇埋字幕後彩蛋|大家记得留低睇埋字幕后彩蛋|16|4|积极|中国|Youtube|2023-02-10
台灣要去哪看，等上映|台湾要去哪看，等上映|20|4|积极|中国|Youtube|2023-02-10
这是在香港上映吗？大陆许多地方已经下架了。|这是在香港上映吗？大陆许多地方已经下架了。|0|4|积极|中国|Youtube|2023-02-10
大家覺得《流浪地球》有無機會超越《明日戰記》票房|大家觉得《流浪地球》有无机会超越《明日战记》票房|7|4|积极|中国|Youtube|2023-02-09
好看|好看|7|4|积极|中国|Youtube|2023-02-09
恢宏而壯麗的史詩|恢宏而壮丽的史诗|17|4|积极|中国|Youtube|2023-02-09
除了星际穿越interstellar, 华人导演郭帆科幻影片在我自己的科幻电影名册上在记录着了可以绐我去电影院观看7次数的作品流浪地球|除了星际穿越interstellar, 华人导演郭帆科幻影片在我自己的科幻电影名册上在记录着了可以绐我去电影院观看7次数的作品流浪地球|1|4|积极|中国|Youtube|2023-02-09
Ai 翻译耳机把全人类不同种族民族语音言Together连接翻译会实现我信流浪地球|Ai 翻译耳机把全人类不同种族民族语音言Together连接翻译会实现我信流浪地球|0|4|积极|中国|Youtube|2023-02-09
过年时去看了，非常震撼感人！剧情更迭～扣人心弦，特效庞大震撼，全程都没有离开座位，中国科幻电影的新里程碑，演员阵容庞大，所有演员演技入微 ，大手笔大制作，堪称完美，绝对胜过好莱坞大片。|过年时去看了，非常震撼感人！剧情更迭～扣人心弦，特效庞大震撼，全程都没有离开座位，中国科幻电影的新里程碑，演员阵容庞大，所有演员演技入微 ，大手笔大制作，堪称完美，绝对胜过好莱坞大片。|53|4|积极|中国|Youtube|2023-02-09
真的好看|真的好看|9|4|积极|中国|Youtube|2023-02-09
好正！！！近5年睇過最正嘅硬核科幻片！畫面精美達到荷里活頂尖水準，劇情精彩全程無尿點！！！强烈推薦！！建議唔好飲水，信息量極大|好正！！！近5年睇过最正嘅硬核科幻片！画面精美达到荷里活顶尖水准，剧情精彩全程无尿点！！！强烈推荐！！建议唔好饮水，信息量极大|128|4|积极|中国|Youtube|2023-02-09
一定要看|一定要看|11|4|中立|中国|Youtube|2023-02-08
買了飛，期待星期四去看|买了飞，期待星期四去看|23|4|中立|中国|Youtube|2023-02-07
世界上有很多价值观，一个是个人主义，一个是集体主义，你是个人主义这是你的权利和自由，集体主义是一种人人为我，我为人人的思想，虽然两者冲突，但是给予人们选择的权利才是最重要的。按照如果我在流浪地球来说，我应该是愿意牺牲的，为了我的父母我的家人，当然这只能是我个人愿意才行，谁强迫都不允许。|世界上有很多价值观，一个是个人主义，一个是集体主义，你是个人主义这是你的权利和自由，集体主义是一种人人为我，我为人人的思想，虽然两者冲突，但是给予人们选择的权利才是最重要的。按照如果我在流浪地球来说，我应该是愿意牺牲的，为了我的父母我的家人，当然这只能是我个人愿意才行，谁强迫都不允许。|1|4|积极|中国|Youtube|2023-03-05
刷了好几遍！唯一的遗憾就是没有在IMAX上映的场次...|刷了好几遍！唯一的遗憾就是没有在IMAX上映的场次...|0|4|消极|中国|Youtube|2023-02-24
It's definately a moive|这绝对是一部电影|0|4|积极|牙买加|Youtube|2023-02-21
Watched the wandering earth and been watching Three Body these day, I somehow started feeling our earth is about to die in real lmao.|这几天看了《流浪地球》和《三体》，不知怎么的，我开始觉得我们的地球真的要灭亡了。|1|4|积极|加拿大|Youtube|2023-02-15
史诗级了，导演可以在中国科幻影史留下浓墨重彩的一笔。希望可以继续留彩。|史诗级了，导演可以在中国科幻影史留下浓墨重彩的一笔。希望可以继续留彩。|0|4|积极|中国|Youtube|2023-02-14
Anyone care to mention that without the Suns gravitational pull the earth's core would stop rotating we would then lose our gravity and our atmospher|有没有人愿意提一下，如果没有太阳的引力，地核就会停止旋转，我们就会失去引力和大气层|0|4|积极|新加坡|Youtube|2023-02-14
So in nearly 100 years in the future the Chinese are still flying fossil fuel jet fighters? Right......|所以在未来的近100年里，中国人仍然在驾驶化石燃料的喷气式战斗机?对吧……|0|4|积极|美国|Youtube|2023-02-14
目前看过最好的国产科幻片，推荐各位朋友看一看|目前看过最好的国产科幻片，推荐各位朋友看一看|0|4|积极|中国|Youtube|2023-02-10
Dear ball GO GO GO!|亲爱的球，加油，加油!|0|4|积极|新西兰|Youtube|2023-02-10
流浪地球2 MOSS回忆录 |流浪地球2 MOSS回忆录 |3|4|积极|中国|Youtube|2023-02-09
带着地球家园去流浪，这是独属于中国人的浪漫。|带着地球家园去流浪，这是独属于中国人的浪漫。|0|4|积极|中国|Youtube|2023-02-09
It's funny how People who type Chinese or Chinglish are more negative than the people who type English about the movie. And they can't even wrap thei|很有趣的是，打中文或中式英语的人比打英文的人对这部电影更消极。他们甚至不会包装|0|4|积极|爱尔兰|Youtube|2023-02-08
评论唱衰的都是说中文的|评论唱衰的都是说中文的|3|4|消极|中国|Youtube|2023-02-08
Shame on Chinese Communist Party‘s movie. The concept of forcing people over the age of 50 to die is disgusting.|为中国共产党的电影感到羞耻。强迫50岁以上的人死亡的想法令人作呕。|1|4|积极|英国|Youtube|2023-02-07
2023-2-7|The 2023-2-7|0|4|消极|牙买加|Youtube|2023-02-06
作为中国人，我有点不爽，至于拍那么多外国人和外国语言么？后来我意识到，这是导演和剧组境界比我更高的地方：这不是一个展示中国人的电影，这是一个全世界人民大团结的电影！危机当前，唯有责任，唯有团结！|作为中国人，我有点不爽，至于拍那么多外国人和外国语言么？后来我意识到，这是导演和剧组境界比我更高的地方：这不是一个展示中国人的电影，这是一个全世界人民大团结的电影！危机当前，唯有责任，唯有团结！|0|4|积极|中国|Youtube|2023-02-06
技术有进步。说实话，故事结构有些乱，靠旁白去解释情节。文戏不太行，用中国北方式的尴尬国际交流笑点，用中文没问题，语言完全不通更是大bug.还是受到政治正确的制衡，吹吹CCP,政治正确。联合国代表太过于共党的官僚作风，大道理说，不给点火，就凭念想  联合国都听你的。。。|技术有进步。说实话，故事结构有些乱，靠旁白去解释情节。文戏不太行，用中国北方式的尴尬国际交流笑点，用中文没问题，语言完全不通更是大bug.还是受到政治正确的制衡，吹吹CCP,政治正确。联合国代表太过于共党的官僚作风，大道理说，不给点火，就凭念想  联合国都听你的。。。|0|4|积极|中国|Youtube|2023-02-05
"Il n'est pas de sauveurs suprêmes,Ni dieu, ni César, ni tribun！"|他既不是最高的救世主,神、凯撒、或出生!|1|4|积极|法国|Youtube|2023-02-04
This is going to be *Good*, but will require some background information covered before entering the theatre. Some of the sci-fi and tech plots prese|这将会很“好”，但是在进入剧院之前需要了解一些背景知识。一些科幻和科技情节很有说服力|5|4|积极|加拿大|Youtube|2023-02-03
把主旋律去掉，少点俄罗斯和非洲小黑，别的国家摊匀一点就基本无可挑剔了。好几个长镜头非常可圈可点|把主旋律去掉，少点俄罗斯和非洲小黑，别的国家摊匀一点就基本无可挑剔了。好几个长镜头非常可圈可点|0|4|积极|中国|Youtube|2023-02-03
China being the last to get their internet traffic going, the great firewal of china strikes again |中国是最后一个开通互联网流量的国家，中国的防火墙又来了|0|4|积极|加拿大|Youtube|2023-02-03
The heroes of Marvel and DC have become more and more boring. The country that saves the world in the movie and destroys the world in reality is the |漫威和DC的英雄越来越无趣了。电影中拯救世界，现实中毁灭世界的国家是|4|4|积极|加拿大|Youtube|2023-02-03
9.5分（扣到的那0.5理由，为了控制在3小时之内而剪掉的80分钟应该加入，然后分成上下两部电影会更好，很多人感觉节奏太快没看懂）|9.5分（扣到的那0.5理由，为了控制在3小时之内而剪掉的80分钟应该加入，然后分成上下两部电影会更好，很多人感觉节奏太快没看懂）|4|4|消极|中国|Youtube|2023-02-03
Hollywood movies always show us that only 'America' is the world's savior but Chinese movies are different. In real life America also try to be the w|好莱坞电影总是告诉我们，只有“美国”是世界的救世主，但中国电影不同。在现实生活中，美国也试图成为世界第一|4|4|积极|澳大利亚|Youtube|2023-02-03
When will it be released in Japan?|什么时候在日本上映?|9|4|积极|马来西亚|Youtube|2023-02-02
爛片中的戰鬥機|烂片中的战斗机|1|4|中立|中国|Youtube|2023-02-01
amazing movie|神奇的电影|0|4|积极|爱尔兰|Youtube|2023-02-01
就冲MOSS最后那句话，三体正统传承就在这儿了，甚至在这电影的评论里也能体会到那句话的意义。我认为文明发展的最大阻碍从不是弱小，而是傲慢！|就冲MOSS最后那句话，三体正统传承就在这儿了，甚至在这电影的评论里也能体会到那句话的意义。我认为文明发展的最大阻碍从不是弱小，而是傲慢！|2|4|积极|中国|Youtube|2023-02-01
Xijinpooh|西金普|0|4|积极|马耳他|Youtube|2023-02-01
in Hollywood movie only american can save the world in china movie every human have a responsibility to save the world |在好莱坞电影中，只有美国人可以拯救世界，在中国电影中，每个人都有责任拯救世界|4|4|积极|马来西亚|Youtube|2023-02-01
新时代的样板戏而已，一个需要负责时候就投弃权票的国家你能指望它拯救地球？最现成的例子病毒清零三年放弃，相当于流浪地球时间坚持了三个月不到就放弃了。|新时代的样板戏而已，一个需要负责时候就投弃权票的国家你能指望它拯救地球？最现成的例子病毒清零三年放弃，相当于流浪地球时间坚持了三个月不到就放弃了。|1|4|积极|中国|Youtube|2023-01-31
New enemies?? Aliens|新的敌人呢? ?外星人|0|4|积极|西班牙|Youtube|2023-01-30
The New York Times evaluated The Wandering Earth 2 with only 30/100, thinking that it has too many Chinese values. As an objective evaluation, should|《纽约时报》对《流浪地球2》的评价只有30分(满分100分)，认为它有太多的中国价值观。作为客观评价，应该|11|4|积极|新加坡|Youtube|2023-01-30
Race here so divided. Really suck. :/ this is pure fiction and science fiction movie. Nothing is realistic. Let us have enjoy movie together.|这里的种族如此分裂。真的很烂。这是一部纯粹的科幻电影。没有什么是现实的。让我们一起欣赏电影吧。|2|4|积极|马来西亚|Youtube|2023-01-30
作为起点，这已经很不错了，毕竟中国科幻没有这么长的发展时间，以后会越来越好，到时候一定要拍三体！当然也期待流浪地球第三部，第三部可能会是悲剧，是人类内战|作为起点，这已经很不错了，毕竟中国科幻没有这么长的发展时间，以后会越来越好，到时候一定要拍三体！当然也期待流浪地球第三部，第三部可能会是悲剧，是人类内战|8|4|积极|中国|Youtube|2023-01-30
overall a great film in terms of production quality. far better than the first in that aspect. story wise, it holds up but the way it was told would |总的来说，就制作质量而言，这是一部伟大的电影。在这方面比第一个好得多。故事方面，它经得起考验，但它的讲述方式会|6|4|积极|澳大利亚|Youtube|2023-01-30
