content|translated|likes|workId|sentiment|country|platform|postTime
Fantastic animation|神奇的动画|1|4|积极|新西兰|Youtube|2023-04-01
in3,2,1 blast off!|三，二，一，发射!|0|4|消极|加拿大|Youtube|2023-04-01
Amazing masterpiece|令人惊叹的杰作|0|4|积极|马来西亚|Youtube|2023-03-28
While this looks (and sounds) undeniably awesome, what exactly is the point of an orbital elevator, when you using rocket engines anyway? And if you |虽然这看起来(听起来)不可否认的很棒，但当你使用火箭发动机时，轨道电梯的意义到底是什么?如果你|0|4|积极|英国|Youtube|2023-03-25
Looks awesome! Just one nitpick: isn't the whole point of space elevator to remove the need for propulsion during the ascent?|看起来帅呆了!只有一个问题:太空电梯的全部意义不就是在上升过程中不需要推进力吗?|0|4|积极|澳大利亚|Youtube|2023-03-24
我看这段时哭了|我看这段时哭了|1|4|积极|中国|Youtube|2023-03-21
我看IMAX版的时候，地都在震，感觉有升力，很真实|我看IMAX版的时候，地都在震，感觉有升力，很真实|1|4|积极|中国|Youtube|2023-03-20
底下说太空电梯不该用火箭的，那是涡喷发动机和火箭动力组合体，时代背景是2044年，不用火箭你告诉我该用什么东西能赶上这个时间窗口。而且地球都要毁了，多用点化石燃料来提升单次运载吨位显得非常合适，重要的是在2058年前建设完成月球行星发动机，时间才是这其中最紧张重要的因素|底下说太空电梯不该用火箭的，那是涡喷发动机和火箭动力组合体，时代背景是2044年，不用火箭你告诉我该用什么东西能赶上这个时间窗口。而且地球都要毁了，多用点化石燃料来提升单次运载吨位显得非常合适，重要的是在2058年前建设完成月球行星发动机，时间才是这其中最紧张重要的因素|1|4|积极|中国|Youtube|2023-03-19
这一个片段就值回票价了|这一个片段就值回票价了|0|4|中立|中国|Youtube|2023-03-14
GOOD MOVIE|好电影|0|4|积极|新加坡|Youtube|2023-03-12
长足的进步 期待更好的作品|长足的进步 期待更好的作品|0|4|积极|中国|Youtube|2023-03-10
So amazing seeing it in the cinema|在电影院里看到它真是太棒了|0|4|积极|英国|Youtube|2023-03-07
This is awesome!|这太棒了!|0|4|积极|美国|Youtube|2023-03-06
太好看了|太好看了|0|4|中立|中国|Youtube|2023-03-06
China will lead the world into the space age.Bravo|中国将引领世界进入太空时代。布拉沃|2|4|积极|加拿大|Youtube|2023-03-01
细节太差|细节太差|0|4|消极|中国|Youtube|2023-03-01
What’s the point of a space elevator if you are still propelling payload with rockets, even when going down. It’s impressive and all but the design d|如果你还在用火箭推进有效载荷，即使在下降的时候，太空电梯的意义是什么。它令人印象深刻，除了设计|0|4|积极|新加坡|Youtube|2023-03-01
仲唔快d讲声多谢三水哥|仲唔快d讲声多谢三水哥|0|4|积极|中国|Youtube|2023-02-28
这段去4D场才能得到最震撼体会。座椅倾斜加上吹风，身临其境|这段去4D场才能得到最震撼体会。座椅倾斜加上吹风，身临其境|0|4|积极|中国|Youtube|2023-02-27
wow|哇|0|4|中立|加拿大|Youtube|2023-02-27
让我震撼的除了电影呈现出来的效果外，更让我激动的是电影最后的工作人员字幕，全部都是咱国人团队！|让我震撼的除了电影呈现出来的效果外，更让我激动的是电影最后的工作人员字幕，全部都是咱国人团队！|0|4|积极|中国|Youtube|2023-07-26
阿平快来看电影，封神榜和长安三万里都很好看。|阿平快来看电影，封神榜和长安三万里都很好看。|0|4|积极|中国|Youtube|2023-07-24
阿平，欢迎来大陆，有机会可以去看看《长安三万里》《茶啊二中》，不知道国内的动画片会给你带来什么观感|阿平，欢迎来大陆，有机会可以去看看《长安三万里》《茶啊二中》，不知道国内的动画片会给你带来什么观感|1|4|积极|中国|Youtube|2023-07-18
中国航天大队，50 岁以上的，出列！|中国航天大队，50 岁以上的，出列！|1|4|中立|中国|Youtube|2023-07-18
看完流浪地球二 又去看了阿凡达…差别实在太大，阿凡达我都要看睡了，流浪地球二真的一秒都不舍得眨眼睛|看完流浪地球二 又去看了阿凡达…差别实在太大，阿凡达我都要看睡了，流浪地球二真的一秒都不舍得眨眼睛|1|4|积极|中国|Youtube|2023-07-17
美國應該也不敢讓他們的人民看到大陸的這部流浪地球吧|美国应该也不敢让他们的人民看到大陆的这部流浪地球吧|1|4|积极|中国|Youtube|2023-07-17
台灣強烈意識形態 都2023年了...逢中必反的人比較多啊 這是大部分人的選擇且越來越強烈...社會風氣如此   沒辦法...不然兩岸正常交流 那不是很好嗎?|台湾强烈意识形态 都2023年了...逢中必反的人比较多啊 这是大部分人的选择且越来越强烈...社会风气如此   没办法...不然两岸正常交流 那不是很好吗?|1|4|积极|中国|Youtube|2023-07-17
点赞 |点赞 |1|4|积极|中国|Youtube|2023-07-08
下次可以去郊区的商场转转，嘉定的印象城也有不错的电影院~|下次可以去郊区的商场转转，嘉定的印象城也有不错的电影院~|1|4|积极|中国|Youtube|2023-07-07
原来是iapm，我说怎么这么眼熟。。。从这出去转几个路口就到思南路啦~|原来是iapm，我说怎么这么眼熟。。。从这出去转几个路口就到思南路啦~|1|4|消极|中国|Youtube|2023-07-07
阿平出品，必属精品。|阿平出品，必属精品。|1|4|积极|中国|Youtube|2023-07-02
永远不蹭热度的阿平|永远不蹭热度的阿平|1|4|中立|中国|Youtube|2023-06-30
以前上学在电影院打工，电影看第一遍是享受，看第二遍是硬撑|以前上学在电影院打工，电影看第一遍是享受，看第二遍是硬撑|0|4|积极|中国|Youtube|2023-06-30
阿平，华住还是更推荐全季|阿平，华住还是更推荐全季|1|4|积极|中国|Youtube|2023-06-29
纽约时报都说了，这片子最多30分|纽约时报都说了，这片子最多30分|0|4|积极|中国|Youtube|2023-06-29
天下大同，人类空前团结，这是电影里最科幻的地方|天下大同，人类空前团结，这是电影里最科幻的地方|1|4|积极|中国|Youtube|2023-06-29
感觉张艺谋的电影，很多都是刺客好不容易终于接近大BOSS马上就差一步成功，哎，就突然任性了，突然具备历史眼光了，就突然不动手不杀了。。。。。|感觉张艺谋的电影，很多都是刺客好不容易终于接近大BOSS马上就差一步成功，哎，就突然任性了，突然具备历史眼光了，就突然不动手不杀了。。。。。|0|4|积极|中国|Youtube|2023-06-27
阿平，謝謝你的分享綠呱呱們的腦殘是世界公認的NO.1，支持你的努力|阿平，谢谢你的分享绿呱呱们的脑残是世界公认的NO.1，支持你的努力|1|4|积极|中国|Youtube|2023-06-27
流浪地球2确实是不错，就是时长太短了，要分两部比较合适，太多内容了，特效也爱|流浪地球2确实是不错，就是时长太短了，要分两部比较合适，太多内容了，特效也爱|0|4|积极|中国|Youtube|2023-06-27
满江红就算了，烂片，不值得|满江红就算了，烂片，不值得|0|4|消极|中国|Youtube|2023-06-26
流浪地球2真的太好看了，只能说是我这半辈子看过最好的华语片，我贡献了七张票！！|流浪地球2真的太好看了，只能说是我这半辈子看过最好的华语片，我贡献了七张票！！|3|4|积极|中国|Youtube|2023-06-25
终于等到你了！太久没更新了|终于等到你了！太久没更新了|1|4|消极|中国|Youtube|2023-06-25
看完球2一直在等阿平的reaction，球2可以说是中国目前最高规格硬科幻电影了。预言一波，能超越球2的只有球3|看完球2一直在等阿平的reaction，球2可以说是中国目前最高规格硬科幻电影了。预言一波，能超越球2的只有球3|3|4|积极|中国|Youtube|2023-06-25
这么久了我都没看 评价这么高我也要去补了|这么久了我都没看 评价这么高我也要去补了|1|4|中立|中国|Youtube|2023-06-25
CINITY，是中国标准的IMAX。|CINITY，是中国标准的IMAX。|2|4|积极|中国|Youtube|2023-06-25
只有流浪地球更新才能让阿平更新|只有流浪地球更新才能让阿平更新|0|4|积极|中国|Youtube|2023-06-25
B站倒是已经上了4K版，就是要用大会员看。|B站倒是已经上了4K版，就是要用大会员看。|1|4|消极|中国|Youtube|2023-06-25
深海也很好看|深海也很好看|0|4|积极|中国|Youtube|2023-06-25
相比起国产科幻片，我还是更期待国漫，但中国更成熟的还是剧情片，比如《满江红》非常不错|相比起国产科幻片，我还是更期待国漫，但中国更成熟的还是剧情片，比如《满江红》非常不错|0|4|积极|中国|Youtube|2023-06-24
別說台灣了，在歐美逛過很多商場都沒有大陸的商業設計風格那麼現代感，目前我只在迪拜看到過找得到相似的地方。|别说台湾了，在欧美逛过很多商场都没有大陆的商业设计风格那么现代感，目前我只在迪拜看到过找得到相似的地方。|4|4|积极|中国|Youtube|2023-06-24
哇靠阿平回来了|哇靠阿平回来了|0|4|中立|中国|Youtube|2023-06-24
我儿子特别喜欢这部电影，正好放假用两天时间拼好了流浪地球2的月球车乐高模型。|我儿子特别喜欢这部电影，正好放假用两天时间拼好了流浪地球2的月球车乐高模型。|0|4|积极|中国|Youtube|2023-06-24
确实炸裂级别，极品科幻电影|确实炸裂级别，极品科幻电影|0|4|积极|中国|Youtube|2023-06-24
欢迎来大陆观光，祝您玩得开心！|欢迎来大陆观光，祝您玩得开心！|0|4|积极|中国|Youtube|2023-06-24
我在影院看的，音效画面做得是真不错，记得当时看到太空电梯那一幕，把我看得浑身起鸡皮疙瘩。|我在影院看的，音效画面做得是真不错，记得当时看到太空电梯那一幕，把我看得浑身起鸡皮疙瘩。|0|4|积极|中国|Youtube|2023-06-24
阿平的声音好像有点哑，希望是错觉。注意身体，端午安康，阿平。|阿平的声音好像有点哑，希望是错觉。注意身体，端午安康，阿平。|0|4|积极|中国|Youtube|2023-06-24
阿平大陸7月20日電影封神三部曲去看嗎|阿平大陆7月20日电影封神三部曲去看吗|0|4|积极|中国|Youtube|2023-06-24
支持阿平！影片的质量很高~|支持阿平！影片的质量很高~|2|4|积极|中国|Youtube|2023-06-24
阿平多向台湾同胞宣传大陆电影，让他们也感受国家的成长和进步。|阿平多向台湾同胞宣传大陆电影，让他们也感受国家的成长和进步。|6|4|积极|中国|Youtube|2023-06-24
流浪3要嘛是最后一战，要嘛是数字生命|流浪3要嘛是最后一战，要嘛是数字生命|0|4|积极|中国|Youtube|2023-06-24
第三集盲猜：华仔已经进入数字生命与女儿在第三集登场，吴京（刘培强）已经牺牲，但还有一个孩子……我猜，导演会让吴京继续演刘培强的儿子（但我不希望导演这么做，应该用其他演员来演刘培强儿子，避免观众产生莫名其妙的串联想象和对比、观影疲劳等）|第三集盲猜：华仔已经进入数字生命与女儿在第三集登场，吴京（刘培强）已经牺牲，但还有一个孩子……我猜，导演会让吴京继续演刘培强的儿子（但我不希望导演这么做，应该用其他演员来演刘培强儿子，避免观众产生莫名其妙的串联想象和对比、观影疲劳等）|0|4|积极|中国|Youtube|2023-06-24
App收藏票根的功能很不好 和女朋友一块看电影如果忘记删除票根 被老婆发现 分分钟不是要命吗|App收藏票根的功能很不好 和女朋友一块看电影如果忘记删除票根 被老婆发现 分分钟不是要命吗|0|4|消极|中国|Youtube|2023-06-23
損失的是台灣普通民眾 蔡總統早偷偷看了|损失的是台湾普通民众 蔡总统早偷偷看了|0|4|积极|中国|Youtube|2023-06-23
深海有没看？|深海有没看？|0|4|积极|中国|Youtube|2023-06-23
阿平這樣吹大陸 不怕被剪健保卡？|阿平这样吹大陆 不怕被剪健保卡？|0|4|中立|中国|Youtube|2023-06-23
好棒的介绍，谢谢分享！ 有内容，有深度，有感情！|好棒的介绍，谢谢分享！ 有内容，有深度，有感情！|0|4|积极|中国|Youtube|2023-06-23
我是在五角场的中影的cinity影厅看的4K120帧版本，在初六之后cinity厅非高峰期就是49/59的价格了，我还没有看过激光IMAX，但是对比在氙灯IMAX和CGS看的流浪地球2，我觉得虽然屏幕小了一些，但是沉浸感和观感还是更胜一筹的。我的朋友抱着能追平氙灯IMAX的预期先在北京中影公司楼下|我是在五角场的中影的cinity影厅看的4K120帧版本，在初六之后cinity厅非高峰期就是49/59的价格了，我还没有看过激光IMAX，但是对比在氙灯IMAX和CGS看的流浪地球2，我觉得虽然屏幕小了一些，但是沉浸感和观感还是更胜一筹的。我的朋友抱着能追平氙灯IMAX的预期先在北京中影公司楼下|0|4|积极|中国|Youtube|2023-06-23
我特么当天直接失眠了|我特么当天直接失眠了|0|4|中立|中国|Youtube|2023-06-23
感觉是个电影狂人诶|感觉是个电影狂人诶|0|4|积极|中国|Youtube|2023-06-23
深海其实也很不错|深海其实也很不错|0|4|积极|中国|Youtube|2023-06-23
